{
  "$schema": "https://quentinzhang.github.io/launch-profile-manifest/spec/v0.1/launch-profile-manifest.schema.json",
  "@context": "https://schema.org",
  "manifestVersion": "0.1",
  "id": "https://example.com/.well-known/launch-profile.json",
  "product": {
    "@type": "SoftwareApplication",
    "name": "Example Product",
    "stage": "live",
    "canonicalUrl": "https://example.com",
    "tagline": {"en": "Define it once. Launch it everywhere."},
    "descriptions": {"en": {"short": "A portable product profile example."}},
    "categories": ["Productivity"],
    "audiences": [{"name": "Solo builders"}],
    "features": [{"name": "Portable launch metadata"}],
    "offers": [{"name": "Pro", "price": 19, "currency": "USD", "billingPeriod": "month"}]
  },
  "assets": [{"role": "logo", "url": "https://example.com/logo.png", "alt": {"en": "Example Product logo"}}],
  "claims": [],
  "externalManifests": [{"type": "llms_txt", "url": "https://example.com/llms.txt"}],
  "provenance": {
    "updatedAt": "2026-08-22T00:00:00Z",
    "sources": [{"type": "website", "url": "https://example.com", "retrievedAt": "2026-08-22T00:00:00Z"}],
    "confirmedByUser": true
  },
  "extensions": {}
}
